{
  "$schema": "https://json-schema.org/draft/2020-12/schema",
  "$id": "sightline.event.v1",
  "title": "SightLine node event v1",
  "description": "Every event published by a SightLine node (real or simulated) on sightline/<site>/<node>/event. (c) 2026 Ryan Brown / SightLine. Proprietary.",
  "type": "object",
  "required": ["schema", "event_id", "site_id", "node_id", "ts", "type"],
  "additionalProperties": false,
  "properties": {
    "schema": { "const": "sightline.event.v1" },
    "event_id": { "type": "string", "minLength": 8, "description": "UUIDv4" },
    "site_id": { "type": "string", "minLength": 1 },
    "node_id": { "type": "string", "minLength": 1 },
    "ts": { "type": "string", "format": "date-time", "description": "ISO 8601, simulated or real wall clock at the node" },
    "type": {
      "type": "string",
      "enum": ["detection.start", "detection.update", "detection.end", "motion", "deter.fired", "tamper"]
    },
    "object": {
      "type": "object",
      "required": ["class", "confidence", "track_id"],
      "additionalProperties": false,
      "properties": {
        "class": { "type": "string", "enum": ["person", "vehicle", "animal", "package", "unknown"] },
        "confidence": { "type": "number", "minimum": 0, "maximum": 1 },
        "track_id": { "type": "string", "description": "Node-local track id. Cross-node identity is the correlator's job." },
        "attributes": {
          "type": "object",
          "description": "Free-form classifier attributes (color histogram bins, carried-object flags). Input to re-ID.",
          "additionalProperties": true
        }
      }
    },
    "geometry": {
      "type": "object",
      "additionalProperties": false,
      "properties": {
        "distance_m": { "type": "number", "minimum": 0, "description": "Line-of-sight distance node to target" },
        "ground_m": { "type": "number", "minimum": 0, "description": "Ground-projected distance" },
        "bearing_deg": { "type": "number", "description": "Bearing from node boresight, positive clockwise" },
        "pitch_deg": { "type": "number", "description": "Downward pitch node to target head height" },
        "px_per_m": { "type": "number", "minimum": 0, "description": "Horizontal pixel density at target, best channel" },
        "dori_level": { "type": "string", "enum": ["validate", "identify", "recognize", "observe", "detect", "none"] },
        "channel": { "type": "string", "enum": ["wide", "identity", "door"], "description": "Which sensor produced the best frame" },
        "zone": { "type": "string", "description": "Named yard zone (driveway, porch, side-yard-e ...)" },
        "pos": {
          "type": "object",
          "description": "Site-frame target position in meters (sim always fills this; real nodes fill it when calibrated)",
          "required": ["x", "y"],
          "additionalProperties": false,
          "properties": { "x": { "type": "number" }, "y": { "type": "number" } }
        }
      }
    },
    "media": {
      "type": "object",
      "additionalProperties": false,
      "properties": {
        "thumb_ref": { "type": "string", "description": "Path or URL to the thumbnail for this event" },
        "clip_ref": { "type": "string", "description": "Path or URL to the clip segment on the node's 72h loop" },
        "native_pixels": { "type": "boolean", "description": "True only when frames are unmodified sensor output. Evidence path requires true." },
        "synthetic": { "type": "boolean", "description": "True for simulator output. Synthetic media can never enter the evidence path." }
      }
    },
    "deter": {
      "type": "object",
      "description": "Present on deter.fired events",
      "additionalProperties": false,
      "properties": {
        "pattern": { "type": "string" },
        "segments": { "type": "array", "items": { "type": "string" } },
        "trigger_event_id": { "type": "string" }
      }
    },
    "dwell_s": { "type": "number", "minimum": 0, "description": "Present on detection.end: total seconds in view" }
  }
}
